,adaptation_strategies,author_id,ca_eld_standard_codes,coach_standard_codes,copied_from,created_at,demo,dlm_ee_codes,goal_text,grades,ils_sel_standard_codes,instruction_text,measurement_text,modification_text,ncsc_ccc_codes,ny_prek_standard_codes,objectives,parent_text,published,score,slug,standard_codes,subject,subject_domains,tags,teks_standard_codes,title,udl_adaptations,updated_at,updated_time,uuid,wida_2007_standard_codes
0,"['15362cbc-09bb-4658-830b-659cd2e3fd82', 'fc313bc8-a4c1-4415-ac01-970814eb4eb8', '1e94ca89-17dd-44a3-9e52-b1ba7f6d83da', 'dfd901a1-c9a8-4e2b-8fe1-267579d909ae', '3738b30e-1d0d-4ea4-87e2-19e7606daddc', '9dd2f4d7-8e66-4231-bb0c-de8678d962b7', '8b868a21-cf4c-482c-9e66-bbe00edcfda2', '46e48c4a-b0ad-4ad8-9a62-d853e8c2693a']",106277f8-7d9e-4573-9fb3-e80dd0352343,[],[],4c9c9db6-84c3-4d1e-a583-6df40eea46a3,2015-02-09 16:48:15Z,False,[],"By (date), when appearing anxious (e.g. walking around class, head down) during a grade-level task in the classroom, (name) will use deep [[belly breathing|deep breathing]] and then ask the teacher for help to complete the task (e.g. raising hand, pushing help on a communication device), while refraining from task avoidance behaviors (e.g. disruption, withdrawal, somatic complaints), for a duration of (20) minutes in (4 of 5) task-completion activities.","['6', '7', '8', '9', '10', '11', '12']",[],,,,[],[],"[{'_id': '55a8015e645c28763700007f', 'created_at': '2015-07-16 19:09:18Z', 'level': 'Mild', 'text': 'By (date), when appearing anxious (e.g. walking around class, head down) during a grade-level task in the classroom, (name) will use deep [[belly breathing|deep breathing]] and then use his/her [[visual task schedule|visual task schedule]] to complete the task, while refraining from task avoidance behaviors (e.g. disruption, withdrawal, somatic complaints), for a duration of (15) minutes in (4 of 5) task-completion activities.', 'updated_at': '2015-07-16 19:09:18Z', 'updated_time': 1437073758260, 'uuid': 'f2bd6529-f1cc-4c6d-8282-a4ff6fb17bf4'}, {'_id': '55a8015e645c287637000080', 'created_at': '2015-07-16 19:09:18Z', 'level': 'Moderate', 'text': 'By (date), when appearing anxious (e.g. walking around class, head down) during a task on a [[preferred topic or text|preferred topic]] in the classroom, (name) will use deep [[belly breathing|deep breathing]] and a [[6-second pause|6-second break]], then use his/her [[visual task schedule|visual task schedule]] to complete the task, while refraining from task avoidance behaviors (e.g. disruption, withdrawal, somatic complaints), for a duration of (10) minutes in (3 of 5) task- completion activities.', 'updated_at': '2015-07-16 19:09:18Z', 'updated_time': 1437073758261, 'uuid': 'a14e1e5e-ba25-4b33-85e0-d4c60cacbefb'}, {'_id': '55a8015e645c287637000081', 'created_at': '2015-07-16 19:09:18Z', 'level': 'Intense', 'text': 'By (date), when appearing anxious (e.g. walking around class, head down) during a task on a [[preferred topic or text|preferred topic]] in the classroom, (name) will use an item from his/her [[sensory toolbox|sensory toolbox]] (e.g. kusch ball) and a [[6-second pause|6-second break]] in a [[calming space|calming space]], then use his/her [[visual task schedule|visual task schedule]] to complete the task, while refraining from task avoidance behaviors (e.g. disruption, withdrawal, somatic complaints), for a duration of (5) minutes in (3 of 5) task- completion activities.', 'updated_at': '2015-07-16 19:09:18Z', 'updated_time': 1437073758261, 'uuid': 'ee9696f2-df55-4393-ba74-a7f843ecfd38'}]",,True,0.9,reduce-anxious-behaviors-during-class,[],Autism,['Self-Monitoring'],,[],Reduce Anxious Behaviors During Class,"[{'_id': '54d8e4cf645c2867660002f2', 'created_at': '2014-02-25 18:51:51Z', 'text': 'To promote expectations and optimize motivation for attending school, students can be a part of creating their own attendance plan with their teachers and parents/caregivers. Students can then be responsible for managing their own goals with the support from a mentor or [[peer buddies|peer buddy]]. Peer cooperation can increase engagement and help provide natural [[peer buddies|peer buddies]] between students for future relationships.', 'udl_standard_checkpoint_ref': 'UDL III 9.1', 'udl_standard_long_ref': 'UDL III 9.1 Provide Multiple Means of Engagement: Promote expectations and beliefs that optimize motivation', 'udl_standard_short_ref': 'UDL III 9.1 Promote expectations and beliefs that optimize motivation', 'updated_at': '2015-07-16 19:09:18Z', 'updated_time': 1437073758272, 'uuid': '2842430a-c25b-4e3b-bb4f-e19c69bbfb7f'}, {'_id': '54d8e4cf645c2867660002f3', 'created_at': '2014-02-25 18:56:05Z', 'text': 'Students with school phobia lack the confidence in their skills as a student. They can become very anxious and overwhelmed by how much information they have to remember and manage. Teachers can help students become better self-managers of their own learning by providing [[problem solving checklist|checklists]] and guides for note-taking and [[graphic organizers|graphic organizers]] for organizing information.', 'udl_standard_checkpoint_ref': 'UDL II 6.3', 'udl_standard_long_ref': 'UDL II 6.3 Provide Multiple Means of Action and Expression: Facilitate managing information and resources', 'udl_standard_short_ref': 'UDL II 6.3 Facilitate managing information and resources', 'updated_at': '2015-07-16 19:09:18Z', 'updated_time': 1437073758273, 'uuid': '12b2113b-2ae8-405b-9293-a753a0625edc'}, {'_id': '54d8e4cf645c2867660002f4', 'created_at': '2014-02-25 19:43:23Z', 'text': ""Teachers can maximize feeling safe in the school by providing strategies that support optimal memory and transfer when learning new content. One strategy teachers can use is visual imagery or [[role play and dramatization|role play]] to talk about being safe at school, and what students can do if they don't feel safe."", 'udl_standard_checkpoint_ref': 'UDL I 3.4', 'udl_standard_long_ref': 'UDL I 3.4 Provide Multiple Means of Representation: Maximize transfer and generalization', 'udl_standard_short_ref': 'UDL I 3.4 Maximize transfer and generalization', 'updated_at': '2015-07-16 19:09:18Z', 'updated_time': 1437073758275, 'uuid': 'e14c3047-5f57-4e35-b6af-a0ece2a821ca'}]",2015-07-16 19:09:18Z,1437073758278,a5b67a33-b4d0-4e8d-b1dd-8067e1421de0,[]
1,"['4bb7198b-7fe6-4d59-94a3-201839231374', '45ed86e1-bdc3-499b-a430-07e638b1693f', '6f81fef3-7517-4fb9-b6c0-54b9b4facc6f', '7f2e7a09-a96b-4447-965c-b43d88e66970', '5e958c19-132c-4d0f-836e-a50de8729feb', '3ef55d5f-d901-49fc-8d0c-e3e57e3c3559', '7740d691-5f46-4ffa-ac39-2482a92e7857', 'c37b57c1-483a-4c2b-971f-afc8cce1e616']",75df5c7a-ef71-40f7-ac22-fd5c6eb08d6e,[],[],28c3f532-f2a1-4e35-9976-40de48d8f36a,2015-02-18 05:46:58Z,False,[],"By (date), after watching a [[modeling behaviors|teacher model]] on strategies to use when unsure of what to do during a class quiz, during a quiz (or another specific time in the school day), when demonstrating off-task behaviors (e.g. off-topic conversations, distracting peers, publicly shutting down), (name) will use a [[ http://www.interventioncentral.org/self_management_self_monitoring | Self-Monitoring Scale ]] on his/her desk to identify (2) on-task behaviors (e.g. re-reading a question/prompt, raise hand to ask for help) and then demonstrate the (2) on-task behaviors, within (3) minutes of viewing the scale, while refraining off-task behaviors (e.g. off-topic conversations, distracting peers, publicly shutting down) for (20) minutes for (3 out of 3) class quizzes.

[[ http://www.interventioncentral.org/sites/default/files/pdfs/pdfs_blog/self_management_self_monitoring_1.pdf  |  Example for Self-Monitoring Scale ]]:
Students can use a Self-Monitoring Scale to evaluate and track their own performance related to target behaviors.The scale can empower students in implementing their own interventions and can also be used for students to self-reflect and set future goals.","['6', '7', '8', '9', '10', '11', '12']",[],,,,[],[],"[{'_id': '55a932af645c28c557000001', 'created_at': '2015-07-17 16:51:59Z', 'level': 'Mild', 'text': 'By (date), after watching a [[modeling behaviors|teacher model]] on strategies to use when unsure of what to do during a class quiz, during a quiz (or another specific time in the school day), when demonstrating off-task behaviors (e.g. off-topic conversations, distracting peers, publicly shutting down) and given a [[visual cueing|visual cue]] (e.g. Teacher points to the self-monitoring scale), (name) will use a [[ http://www.interventioncentral.org/self_management_self_monitoring | Self-Monitoring Scale ]] on his/her desk to identify (2) on-task behaviors (e.g. re-reading a question/prompt, raise hand to ask for help) and then demonstrate the (2) on-task behaviors, within (3) minutes of viewing the scale, while refraining off-task behaviors (e.g. off-topic conversations, distracting peers, publicly shutting down) for (20) minutes for (3 out of 3) class quizzes.', 'updated_at': '2015-07-17 16:51:59Z', 'updated_time': 1437151919723, 'uuid': '75e793ca-6e36-4c66-936d-3e1df21ad9ad'}, {'_id': '55a932af645c28c557000002', 'created_at': '2015-07-17 16:51:59Z', 'level': 'Moderate', 'text': 'By (date), after watching a [[video|video model]] on strategies to use when unsure of what to do during a class quiz, during a quiz (or another specific time in the school day), when demonstrating off-task behaviors (e.g. off-topic conversations, distracting peers, publicly shutting down) and given a [[first-then board|first-then card]] (e.g. First quiz, then [[reinforcers|preferred item or activity]]), (name) will use a [[ http://www.interventioncentral.org/self_management_self_monitoring | Self-Monitoring Scale ]] on his/her desk to identify (2) on-task behaviors (e.g. re-reading a question/prompt, raise hand to ask for help) and then demonstrate the (2) on-task behaviors, within (5) minutes of viewing the scale, while refraining off-task behaviors (e.g. off-topic conversations, distracting peers, publicly shutting down) for (10) minutes for (2 out of 3) class quizzes.', 'updated_at': '2015-07-17 16:51:59Z', 'updated_time': 1437151919724, 'uuid': 'ca25d833-7e49-443c-95e9-2f34136f6270'}, {'_id': '55a932af645c28c557000003', 'created_at': '2015-07-17 16:51:59Z', 'level': 'Intense', 'text': ""By (date), after watching a [[video|video model]] on strategies to use when unsure of what to do during a class quiz, during a quiz (or another specific time in the school day), when demonstrating off-task behaviors (e.g. off-topic conversations, distracting peers, publicly shutting down) and given a [[first-then board|first-then card]] (e.g. First quiz, then [[reinforcers|preferred item or activity]]), (name) will use a [[ visual behavior poster|visual rue card ]] (e.g. photo card that shows examples of on-task behaviors, such as re-reading a question or prompt when student doesn't understand or asking for help) ) on his/her desk to demonstrate at least (1) on-task behavior, within (5) minutes of viewing the scale, while refraining off-task behaviors (e.g. off-topic conversations, distracting peers, publicly shutting down) for (5) minutes for (2 out of 3) class quizzes."", 'updated_at': '2015-07-17 16:51:59Z', 'updated_time': 1437151919724, 'uuid': '8b7c3b95-0a50-444a-b562-220f71f7a1d8'}]",,True,0.9,limit-off-task-behavior-during-a-quiz,[],Autism,['Self-Monitoring'],,[],Limit Off-Task Behavior During a Quiz,"[{'_id': '54e42751645c28103600026d', 'created_at': '2014-03-10 03:59:03Z', 'text': 'When implementing a self-monitoring scale, teachers may elect to facilitate [[ Goal Setting  |  collaborative goal setting]]. Setting goals together can empower the student to take an active role in her own intervention while also enabling the teacher to offer guidance around goal setting. This may be especially powerful for middle school students that may be craving autonomy and also requiring support. Working together, teachers and students can set goals around on-task behaviors to increase, off-task behaviors to decrease, and measurable milestones to work toward.', 'udl_standard_checkpoint_ref': 'UDL II 6.1', 'udl_standard_long_ref': 'UDL II 6.1 Provide Multiple Means of Action and Expression: Guide appropriate goal-setting', 'udl_standard_short_ref': 'UDL II 6.1 Guide appropriate goal-setting', 'updated_at': '2015-07-17 16:51:59Z', 'updated_time': 1437151919738, 'uuid': '5c3b99a2-a370-457f-8afd-c7793b82a30f'}, {'_id': '54e42751645c28103600026e', 'created_at': '2014-03-12 05:41:03Z', 'text': 'While [[self-monitoring|self-monitoring]] can prove effective in impacting behavior change, it requires students to measure and evaluate their own performance. Accurately evaluating oneself can be a difficult skill to learn. It may be the case that a middle school student has had very little prior experience with this skill as measuring and evaluating behavior is often done by the teacher in prior grades. In order to support students in effectively using the self-monitoring scale, teachers may use [[ Think Aloud | a think aloud ]] to model utilizing the scale. A teacher may wish to use think aloud to demonstrate how she would use the scale to impact her own behavior, or she could model how she might use it if she were the student.', 'udl_standard_checkpoint_ref': 'UDL I 3.3', 'udl_standard_long_ref': 'UDL I 3.3 Provide Multiple Means of Representation: Guide information processing, visualization, and manipulation', 'udl_standard_short_ref': 'UDL I 3.3 Guide information processing, visualization, and manipulation', 'updated_at': '2015-07-17 16:51:59Z', 'updated_time': 1437151919739, 'uuid': '16cbe07e-c206-4437-a971-5b24a882773d'}, {'_id': '54e42751645c28103600026f', 'created_at': '2014-03-13 03:53:09Z', 'text': ""A student engaging in off-task behaviors can interfere with classmates' ability to access classroom content. As peers are often impacted by off-task behaviors, and peer influence is often very strong in middle school, the teacher may consider utilizing [[ Social Supports | social supports ]] to help students internalize what on-task behavior looks like, as well as the negative impact disruptive behavior can have on one's peers. For instance, when the teacher and student are crafting the self-monitoring scale, they can jointly observe the student's classmates to identify on-task vs. off-task behaviors. The student could also identify trusted peers to look to at the start of independent practice to serve as a live model for on-task engagement."", 'udl_standard_checkpoint_ref': 'UDL III 8.3', 'udl_standard_long_ref': 'UDL III 8.3 Provide Multiple Means of Engagement: Foster collaboration and communication', 'udl_standard_short_ref': 'UDL III 8.3 Foster collaboration and communication', 'updated_at': '2015-07-17 16:51:59Z', 'updated_time': 1437151919741, 'uuid': 'dc3ebf1c-dee8-45f8-85be-cc47c8b5c17b'}]",2015-07-17 16:51:59Z,1437151919745,0bf9c11c-2941-46de-9994-02714b370b49,[]
2,"['8ce153db-a210-4317-9ed8-4d7a6ce4f75c', 'c879d159-e4a0-4e38-a243-0df30b19c442', 'c37b57c1-483a-4c2b-971f-afc8cce1e616', 'ac8a2d1a-84a1-422c-91a6-d93c02fbd21e', 'deeb076c-363d-48c7-b424-31e28a62966b', '7fd3fa7e-c936-4ede-acf6-ccdaed60994b', '5c58c104-a506-4f85-9795-540a7821f503', '718c4fc9-401c-469e-9163-b3cb71a5b10e']",4518a6c9-9f58-4b13-94d7-00d4214bda4f,[],[],c6be7705-7f57-422f-b8ac-3ccec9bd5437,2015-02-18 05:58:45Z,False,[],"By (date),  immediately after reading a [[social narratives|social narrative]] that describes hypothetical or real peer pressure scenarios (e.g. peers trying to coerce the student to steal from the teacher), when asked by the teacher to verbally identify: what the student in the narrative was being pressured to do/say, any negative consequences, and ways to avoid or overcome peer pressure, (name) will verbally identify what a peer is trying to pressure the student to do, identify at least (1) negative consequence of complying with the peer pressure, and provide at least (2) possible ways to overcome peer pressure for each given scenario, in (3 out of 3) peer pressure narratives.","['6', '7', '8', '9', '10', '11', '12']",[],,,,[],[],"[{'_id': '55ad9590645c282e10000029', 'created_at': '2015-07-21 00:42:56Z', 'level': 'Mild', 'text': 'By (date),  immediately after reading a [[social narratives|social narrative]] at school that describes hypothetical or real peer pressure scenarios (e.g. peers trying to coerce the student to steal from the teacher) and then having an [[social role play|opportunity to practice]] the scenario, when asked by the teacher to verbally identify: what the student in the narrative was being pressured to do/say, any negative consequences, and ways to avoid or overcome peer pressure, (name) will verbally identify what a peer is trying to pressure the student to do, identify (1) negative consequence of complying with the peer pressure, and provide at least (2) possible ways to overcome peer pressure for each given scenario, in (3 out of 3) peer pressure narratives.', 'updated_at': '2015-07-21 00:42:56Z', 'updated_time': 1437439376210, 'uuid': 'e2a41c93-ac42-4834-8e79-7a07f711a41f'}, {'_id': '55ad9590645c282e1000002a', 'created_at': '2015-07-21 00:42:56Z', 'level': 'Moderate', 'text': 'By (date),  immediately after reading a [[social narratives|social narrative]] that describes hypothetical or real peer pressure scenarios (e.g. peers trying to coerce the student to steal from the teacher) and includes [[visual aids|photos]] to portray each scene, and then having an [[social role play|opportunity to practice]] the scenario using a [[reference materials|teacher-made script]], when asked by the teacher to verbally identify: what the student in the narrative was being pressured to do/say, any negative consequences, and ways to avoid or overcome peer pressure, (name) will verbally identify what a peer is trying to pressure the student to do, identify (1) negative consequence of complying with the peer pressure, and provide at least (1) possible ways to overcome peer pressure for each given scenario using [[sentence starters|sentence starters]] (e.g. Teacher says ""If the student steals, then he might get...""), in (2 out of 3) peer pressure role playing opportunities.', 'updated_at': '2015-07-21 00:42:56Z', 'updated_time': 1437439376211, 'uuid': '97c9ee09-45aa-468a-a5db-4052a056463f'}, {'_id': '55ad9590645c282e1000002b', 'created_at': '2015-07-21 00:42:56Z', 'level': 'Intense', 'text': 'By (date), immediately after watching a [[video|video model]] that shows hypothetical or real peer pressure scenarios (e.g. peers trying to coerce the student to steal from the teacher) and then having an [[social role play|opportunity to practice]] the scenario using a [[reference materials|teacher-made script]], when asked by the teacher to verbally identify: what the student in the narrative was being pressured to do/say, any negative consequences, and ways to avoid or overcome peer pressure, (name) will choose what a peer is trying to pressure the student to do, choose (1) negative consequence of complying with the peer pressure, and choose (1) possible ways to overcome peer pressure for each given scenario from a [[multiple choice|choice]] of (3) written responses for each response (e.g. 3 written choices for identifying what the peer is trying to pressure the student to do, 3 written choices for identifying ways to overcome the situation, etc.), in (2 out of 3) peer pressure video.', 'updated_at': '2015-07-21 00:42:56Z', 'updated_time': 1437439376211, 'uuid': '0d90ed20-cc55-4e53-9e5e-4105d0729cd5'}]",,True,0.9,identify-peer-pressure,[],Autism,['Social Communication'],,[],Identify Peer Pressure,"[{'_id': '54e42a15645c28dd410001b7', 'created_at': '2014-01-31 14:34:35Z', 'text': 'Instead of having students work independently to read and write about peer pressure, teachers may facilitate [[Social Role Play|role plays]] in which students act out different peer pressure scenarios and strategies for coping with them. Role plays add a kinesthetic element to the learning activity, and provide students an opportunity to practice and receive feedback on peer pressure deflection strategies.', 'udl_standard_checkpoint_ref': 'UDL III 7.3', 'udl_standard_long_ref': 'UDL III 7.3 Provide Multiple Means of Engagement: Minimize threats and distractions', 'udl_standard_short_ref': 'UDL III 7.3 Minimize threats and distractions', 'updated_at': '2015-07-21 00:42:56Z', 'updated_time': 1437439376222, 'uuid': 'b2182750-bc6c-4aa1-957c-f57350d4828c'}, {'_id': '54e42a15645c28dd410001b8', 'created_at': '2014-01-31 14:48:27Z', 'text': 'Instead of students identifying and justifying their strategies on checklists and in writing, teachers could provide text-free [[Picture Story Telling|comic strips]] portraying peer pressure scenarios and have students write in the dialogue and captions to express how the character in the comic should deal with the situation. Pictures allow students to study the facial expressions and body language associated with peer pressure scenarios and help visual learners remain engaged and more fully comprehend the learning activity.', 'udl_standard_checkpoint_ref': 'UDL II 5.1', 'udl_standard_long_ref': 'UDL II 5.1 Provide Multiple Means of Action and Expression: Use multiple media for communication', 'udl_standard_short_ref': 'UDL II 5.1 Use multiple media for communication', 'updated_at': '2015-07-21 00:42:56Z', 'updated_time': 1437439376224, 'uuid': '79c5c00c-a3e7-4524-bcf2-73ac8f53911b'}, {'_id': '54e42a15645c28dd410001b9', 'created_at': '2014-01-31 15:02:55Z', 'text': ""Instead of having students begin this learning task by reading the characteristics of and strategies for dealing with peer pressure from handouts, teachers could first guide students through the creation of a [[Concept Mapping|concept map]] in which they brainstorm their own definitions and examples of peer pressure, strategies for dealing with it, and emotions associated with it. This group brainstorm focuses students' attention on the lesson objective (recognizing and coping with peer pressure) right away, and adds relevance by allowing students to reflect on their own experiences."", 'udl_standard_checkpoint_ref': 'UDL I 3.1', 'udl_standard_long_ref': 'UDL I 3.1 Provide Multiple Means of Representation: Activate or supply background knowledge', 'udl_standard_short_ref': 'UDL I 3.1 Activate or supply background knowledge', 'updated_at': '2015-07-21 00:42:56Z', 'updated_time': 1437439376226, 'uuid': '6bf03bef-2b94-4cd8-a639-39442d585669'}]",2015-07-21 00:42:56Z,1437439376229,0a5fdd82-b989-4780-bcce-a4b1176904e3,[]
